{
  "schema": 1,
  "id": "acme.hello-theme",
  "name": "Hello theme",
  "version": "0.1.0",
  "author": "Your name",
  "description": "A dark theme you pick in Appearance, with a small stylesheet. No script.",
  "permissions": [
    "ui:theme",
    "ui:css"
  ],
  "theme": {
    "name": "Hello dark",
    "scheme": "dark",
    "tokens": {
      "--bg-canvas": "#15171c",
      "--accent": "#7aa2f7"
    }
  }
}
