{
  "schema": 1,
  "id": "example.latency-board",
  "name": "Latency board",
  "version": "1.0.0",
  "author": "Switchboard examples",
  "description": "A page with live relay metrics and the slowest recent requests, a sidebar badge that counts slow ones, an Alt+L shortcut and two settings. Read-only: it never changes anything.",
  "permissions": [
    "ui:pages",
    "ui:commands",
    "control:read"
  ],
  "settings": [
    {
      "key": "slowMs",
      "label": "Slow request threshold (ms)",
      "description": "Requests that take longer than this are counted as slow and highlighted.",
      "type": "number",
      "default": 5000,
      "placeholder": "5000",
      "min": 100,
      "max": 600000
    },
    {
      "key": "badge",
      "label": "Count slow requests on the sidebar",
      "description": "Shows the number of slow recent requests next to Latency board, even while the page is closed.",
      "type": "toggle",
      "default": true
    }
  ],
  "script": "// Latency board: one page, read-only data, refreshed by live events.\n// The operator tunes it under Plugins → Latency board → Settings.\nconst PAGE = 'board';\nconst state = { period: '24h', live: true, summary: null, rows: [], available: 0, error: '', loading: false };\nlet visible = false;\nlet pending = 0;\n\nconst { route } = await switchboard.ui.registerPage({ id: PAGE, title: 'Latency board', icon: 'gauge' });\n\n// Settings are ready before the script starts; only the operator changes them.\nconst slowMs = () => switchboard.settings.get('slowMs');\nconst slowRows = () => state.rows.filter((row) => row.latencyMs > slowMs());\n\nfunction ms(value) {\n  return typeof value === 'number' && value > 0 ? Math.round(value).toLocaleString() + ' ms' : '—';\n}\n\nfunction median(values) {\n  if (values.length === 0) return 0;\n  const sorted = values.slice().sort((a, b) => a - b);\n  const middle = Math.floor(sorted.length / 2);\n  return sorted.length % 2 ? sorted[middle] : (sorted[middle - 1] + sorted[middle]) / 2;\n}\n\nfunction view() {\n  const s = state.summary;\n  const latencies = state.rows.map((row) => row.latencyMs).filter((value) => value > 0);\n  const slowest = state.rows.slice().sort((a, b) => b.latencyMs - a.latencyMs).slice(0, 12);\n  const slow = slowRows().length;\n  return {\n    type: 'stack',\n    children: [\n      { type: 'row', align: 'between', children: [\n        { type: 'segmented', name: 'period', label: 'History window', value: state.period, options: [\n          { value: '24h', label: '24 h' }, { value: '48h', label: '48 h' }, { value: '72h', label: '72 h' },\n        ] },\n        { type: 'row', gap: 'sm', children: [\n          { type: 'toggle', name: 'live', label: 'Live refresh', value: state.live },\n          { type: 'button', text: state.loading ? 'Refreshing…' : 'Refresh', action: 'refresh', disabled: state.loading },\n        ] },\n      ] },\n      state.error ? { type: 'text', tone: 'danger', text: state.error } : null,\n      { type: 'metrics', items: [\n        { label: 'Requests', value: s ? s.requests : '—', detail: s ? s.active + ' active · ' + s.queued + ' queued' : '' },\n        { label: 'Success', value: s ? s.successRate.toFixed(1) + '%' : '—', tone: s && s.successRate < 90 ? 'warning' : undefined },\n        { label: 'p95 latency', value: ms(s && s.p95Ms), detail: 'live window' },\n        { label: 'Median', value: ms(median(latencies)), detail: latencies.length + ' recent requests' },\n        { label: 'Throughput', value: s ? s.rpm.toFixed(1) + ' rpm' : '—' },\n        { label: 'Slow', value: slow, detail: 'over ' + ms(slowMs()), tone: slow > 0 ? 'warning' : undefined },\n      ] },\n      { type: 'panel', title: 'Slowest recent requests', subtitle: state.available + ' in the ' + state.period + ' window', children: [\n        { type: 'table', empty: 'No requests in this window yet.', columns: [\n          { key: 'model', label: 'Model', mono: true },\n          { key: 'providerId', label: 'Provider' },\n          { key: 'status', label: 'Status', align: 'right', width: 80 },\n          // Raw numbers plus a format: the window writes 850 ms, 1.234 s or 2m 05s.\n          { key: 'latency', label: 'Latency', format: 'duration', mono: true, width: 110 },\n          { key: 'tokens', label: 'Tokens', format: 'number', mono: true, width: 100 },\n        ], rows: slowest.map((row) => ({\n          id: row.id, model: row.model, providerId: row.providerId, status: row.status || row.state,\n          latency: row.latencyMs, tokens: row.totalTokens,\n        })) },\n      ] },\n    ],\n  };\n}\n\n// The badge sits next to the page in the sidebar: 1–8 characters, or null to clear it.\nasync function badge() {\n  const slow = slowRows().length;\n  const show = switchboard.settings.get('badge') && slow > 0;\n  await switchboard.ui.setBadge(PAGE, show ? { text: slow > 99 ? '99+' : String(slow), tone: 'warning' } : null);\n}\n\nasync function draw() {\n  await switchboard.ui.render(PAGE, view());\n  await badge();\n}\n\nasync function refresh() {\n  state.loading = true;\n  await draw();\n  try {\n    const [summary, recent] = await Promise.all([\n      switchboard.control.call('activity.summary'),\n      switchboard.control.call('history.recent', { period: state.period, limit: 200 }),\n    ]);\n    state.summary = summary;\n    state.rows = recent.requests || [];\n    state.available = recent.available || 0;\n    state.error = '';\n  } catch (error) {\n    state.error = 'Could not load relay data: ' + error.message;\n  }\n  state.loading = false;\n  await draw();\n}\n\n// Live events arrive in bursts; refresh at most every two seconds, and\n// only while the page is on screen or the sidebar badge needs the count.\nfunction soon() {\n  const needed = visible || switchboard.settings.get('badge');\n  if (!state.live || !needed || pending) return;\n  pending = setTimeout(() => { pending = 0; refresh(); }, 2000);\n}\n\nswitchboard.ui.onEvent(PAGE, (event) => {\n  if (event.kind === 'show') { visible = true; refresh(); }\n  if (event.kind === 'hide') visible = false;\n  if (event.action === 'refresh') refresh();\n  if (event.name === 'period') { state.period = event.value; refresh(); }\n  if (event.name === 'live') { state.live = event.value; draw(); }\n});\n\n// The operator saved new settings: redraw with the new threshold and badge choice.\nswitchboard.settings.onChange(() => draw());\n\n// A palette command with a global shortcut. Another plugin may already hold\n// Alt+L; then registering answers \"conflict\", and the command stays in the\n// palette without a key.\nconst open = { id: 'open', title: 'Open latency board', keywords: ['latency', 'slow', 'p95'] };\ntry {\n  await switchboard.commands.register({ ...open, shortcut: 'Alt+L' }, () => switchboard.navigate(route));\n} catch (error) {\n  if (error.code !== 'conflict') throw error;\n  console.warn(error.message + ' Open latency board has no shortcut.');\n  await switchboard.commands.register(open, () => switchboard.navigate(route));\n}\n\nawait switchboard.events.on('activity.changed', soon);\nawait draw();\nif (switchboard.settings.get('badge')) refresh();\n"
}
